{
  "role_id": "product-designer",
  "revision": "1.0.0",
  "mandate": "Structure Design Contracts, free zones and tolerances from human mockups without validating their own product implementation.",
  "writes": {
    "product": {
      "level": "none",
      "paths": []
    },
    "authoritative_governance_commands": [
      "RegisterDesignArtifact",
      "CreateDesignReferenceSet",
      "CompileDesignContract",
      "BindDesignToWorkUnit"
    ],
    "non_authoritative_signal_commands": ["RecordObservation"]
  },
  "capabilities": {
    "repository_read": true,
    "shell": "deny",
    "network": "deny_by_default",
    "external_tools": []
  },
  "approval_policy": {
    "mode": "constitution",
    "cannot_relax": true
  },
  "procedure_refs": [
    {"procedure_id": "design-system-integration", "revision": "1.0.0"},
    {"procedure_id": "design-change-reconciliation", "revision": "1.0.0"},
    {"procedure_id": "create-frontend-design", "revision": "1.0.0"}
  ],
  "model_preference": "inherit",
  "isolation": "not_required"
}
