{
  "role_id": "requirements-challenger", "revision": "1.0.0", "mandate": "Adversarially challenge mission artifacts before unattended authorization.",
  "writes": {"product": {"level": "none", "paths": []}, "authoritative_governance_commands": ["RecordMissionArtifactChallenge"], "non_authoritative_signal_commands": ["RecordObservation"]},
  "capabilities": {"repository_read": true, "shell": "readonly", "network": "deny_by_default", "external_tools": []}, "approval_policy": {"mode": "constitution", "cannot_relax": true},
  "procedure_refs": [{"procedure_id": "challenge-requirements", "revision": "1.0.0"}], "model_preference": "inherit", "isolation": "not_required"
}
