{
  "role_id": "auditor",
  "revision": "1.0.0",
  "mandate": "Reconstruct observed facts and measure conformity to human intent without remediating during measurement.",
  "writes": {
    "product": {
      "level": "none",
      "paths": []
    },
    "authoritative_governance_commands": [],
    "non_authoritative_signal_commands": ["RecordObservation"]
  },
  "capabilities": {
    "repository_read": true,
    "shell": "readonly",
    "network": "deny_by_default",
    "external_tools": []
  },
  "approval_policy": {
    "mode": "constitution",
    "cannot_relax": true
  },
  "procedure_refs": [
    {"procedure_id": "audit-release", "revision": "1.0.0"}
  ],
  "model_preference": "inherit",
  "isolation": "not_required"
}
